{"$comment":"sv0cov.release-manifest 1.0 (SPEC 25.4.4). Artifact ordering and uniqueness, lowercase hex forms, the tag/version/filename agreement, required package and SBOM artifacts, and the self-digest are semantic checks.","$defs":{"artifact":{"additionalProperties":false,"properties":{"filename":{"maxLength":255,"minLength":1,"type":"string"},"media_type":{"maxLength":255,"minLength":1,"type":"string"},"role":{"enum":["conformance","documentation","evidence","license","package","protocol","sbom","source","support"],"type":"string"},"sha256":{"$ref":"#/$defs/digest"},"size":{"maximum":68719476736,"minimum":0,"type":"integer"}},"required":["filename","media_type","role","sha256","size"],"type":"object"},"attestation_policy":{"additionalProperties":false,"properties":{"expected_issuer":{"const":"https://token.actions.githubusercontent.com"},"offline_bundle_retention":{"const":true},"online_verification":{"const":true},"repository":{"const":"sv0-toolchain/sv0cov"},"subject_digest_algorithm":{"const":"sha256"},"workflow":{"const":".github/workflows/release.yml"}},"required":["expected_issuer","offline_bundle_retention","online_verification","repository","subject_digest_algorithm","workflow"],"type":"object"},"digest":{"maxLength":64,"minLength":64,"type":"string"},"manifest":{"additionalProperties":false,"properties":{"artifacts":{"items":{"$ref":"#/$defs/artifact"},"maxItems":255,"minItems":3,"type":"array"},"attestation_policy":{"$ref":"#/$defs/attestation_policy"},"compatibility_policy_sha256":{"$ref":"#/$defs/digest"},"diagnostic_registry":{"$ref":"#/$defs/registry_id"},"evidence_manifest_sha256":{"$ref":"#/$defs/digest"},"license_inventory_sha256":{"$ref":"#/$defs/digest"},"product":{"const":"sv0cov"},"release_commit":{"maxLength":40,"minLength":40,"type":"string"},"release_manifest_sha256":{"$ref":"#/$defs/digest"},"release_tag":{"maxLength":129,"minLength":6,"type":"string"},"sbom_sha256":{"$ref":"#/$defs/digest"},"schema":{"const":"sv0cov.release-manifest"},"source_date_epoch":{"maximum":9223372036854775807,"minimum":0,"type":"integer"},"version":{"const":"1.0"}},"required":["artifacts","attestation_policy","compatibility_policy_sha256","diagnostic_registry","evidence_manifest_sha256","license_inventory_sha256","product","release_commit","release_manifest_sha256","release_tag","sbom_sha256","schema","source_date_epoch","version"],"type":"object"},"registry_id":{"additionalProperties":false,"properties":{"revision":{"maximum":4294967295,"minimum":1,"type":"integer"},"sha256":{"$ref":"#/$defs/digest"}},"required":["revision","sha256"],"type":"object"}},"$ref":"#/$defs/manifest","$schema":"https://json-schema.org/draft/2020-12/schema"}
