{"artifacts":[{"filename":"INSTALL.md","media_type":"text/markdown","role":"documentation","sha256":"1b808faff6ca4051a4c34acacccd6ed1f253bbdf4407792fbc7c151cb3a4adae","size":33},{"filename":"LICENSES.tar.gz","media_type":"application/gzip","role":"license","sha256":"b0a0a2594934ab4c00f5348d9104829ea8624d01a014a3329342656f64d8f87a","size":38},{"filename":"sv0cov-1.0.0-protocol.tar.gz","media_type":"application/gzip","role":"protocol","sha256":"457fbae6cfc055d6fe5638e43d762012ab4165fb2ba5f652eb5da503022dc64e","size":51},{"filename":"sv0cov-1.0.0-py3-none-any.whl","media_type":"application/zip","role":"package","sha256":"d7e35aca83868aa6a89005bbd30df52738975f0b960d3df22bb21aea4877c91a","size":52},{"filename":"sv0cov-1.0.0-source.tar.gz","media_type":"application/gzip","role":"source","sha256":"3d3b2ed4efb1ccd2b819e727cf1a772f6f1d9deea5fb32919de35625f7ab81af","size":49},{"filename":"sv0cov-1.0.0.evidence.json","media_type":"application/json","role":"evidence","sha256":"364b4bea918239a49dd03272eba0b0148da2e92e47fd5dfc8bb42fe6d429b349","size":49},{"filename":"sv0cov-1.0.0.spdx.json","media_type":"application/spdx+json","role":"sbom","sha256":"66e26e260ceef319d2c4f26fa575931bec96f8f150a8c9e2120857a452f0ce9a","size":45},{"filename":"sv0cov-1.0.0.tar.gz","media_type":"application/gzip","role":"package","sha256":"836089d4cf2b8382ea12460d197a0226e8878b0c765c08ae5673fbf100f5e567","size":42}],"attestation_policy":{"expected_issuer":"https://token.actions.githubusercontent.com","offline_bundle_retention":true,"online_verification":true,"repository":"sv0-toolchain/sv0cov","subject_digest_algorithm":"sha256","workflow":".github/workflows/release.yml"},"compatibility_policy_sha256":"fa528d3adef61d199a8348ffb48ef0143603ea2e0ad007121c39edc6e3aeb567","diagnostic_registry":{"revision":2,"sha256":"1c2cd283986f9474f0e51196d969ed9fd57f48f29ba9704a00e76b9175ed917f"},"evidence_manifest_sha256":"364b4bea918239a49dd03272eba0b0148da2e92e47fd5dfc8bb42fe6d429b349","license_inventory_sha256":"46610887a7913b54a6b70e7dfaaaab5dec3e7c280521ab981f03e5d63a89279c","product":"sv0cov","release_commit":"0123456789abcdef0123456789abcdef01234567","release_manifest_sha256":"6e11a4d8ea5214a9271b5f2242a2a980d12a62c21d5ee92d45eb400f95ad3bfe","release_tag":"v1.0.0","sbom_sha256":"66e26e260ceef319d2c4f26fa575931bec96f8f150a8c9e2120857a452f0ce9a","schema":"sv0cov.release-manifest","source_date_epoch":1790000000,"version":"1.0"}
